link, name of the league, gender, sponsor, season
https://www.tbf.org.tr/ligler/bsl-2024-2025/maclar , Türkiye Sigorta Basketbol Süper Ligi, Erkek, Türkiye Sigorta, 2024-2025
https://www.tbf.org.tr/ligler/kbsl-2024-2025/maclar , Kadınlar Basketbol Süper Ligi, Kadın, ING, 2024-2025
https://www.tbf.org.tr/ligler/tbl-2024-2025/maclar , Türkiye Basketbol Ligi, Erkek, , 2024-2025
https://www.tbf.org.tr/ligler/tkbl-2024-2025/maclar , Türkiye Kadın Basketbol Ligi, Kadın, , 2024-2025
https://www.tbf.org.tr/ligler/tb2l-2024-2025/maclar , Türkiye Basketbol 2. Ligi, Erkek, , 2024-2025
https://www.tbf.org.tr/ligler/bgl-2024-2025/maclar , Basketbol Gençler Ligi, Erkek, , 2024-2025
https://www.tbf.org.tr/ligler/bglk-2024-2025/maclar , Basketbol Gençler Ligi, Kadın , , 2024-2025
https://www.tbf.org.tr/ligler/ebbl-2024-2025/maclar , Erkekler Bölgesel Basketbol Ligi, Erkek, , 2024-2025
https://www.tbf.org.tr/ligler/kbbl-2024-2025/maclar , Kadınlar Bölgesel Basketbol Ligi, Kadın, , 2024-2025